16/11/2016 01:40:57,19:32:00,Sr. Software Engineer,"Code!  And specify, software & system architecture, a little bit of project mgmt, meetings, operations",development of new software,10 - 20 years,Software company in private sector,6 - 10,A few times a week,A few times a month,A few times a month,A few times a month,Weekly,A few times a day/every day,Jira,I do not know the tool,I do not know the tool,I do not know the tool,I do not know the tool,I do not know the tool,I do not know the tool,Not very relevant,I do not know the tool,Not very relevant,Not very relevant,I do not know the tool,I do not know the tool,I do not know the tool,I do not know the tool,I do not know the tool,Not very relevant,Not very relevant,Very relevant,I do not know the tool,Relevant,I do not know the tool,Not very relevant,I do not know the tool,I do not know the tool,I do not know the tool,Not very relevant,I do not know the tool,I do not know the tool,I do not know the tool,I do not know the tool,I do not know the tool,I do not know the tool,I do not know the tool,I do not know the tool,I do not know the tool,I do not know the tool,I do not know the tool,I do not know the tool,I do not know the tool,I do not know the tool,I do not know the tool,Relevant,I do not know the tool,I do not know the tool,I do not know the tool,I do not know the tool,I do not know the tool,I do not know the tool,I do not know the tool,I do not know the tool,I do not know the tool,No,No,19:40:00,
16/11/2016 01:57:15,09:29:00,Senior System Analyst,"I develop software, precisely working with Android development. Earlier I was also part of .Net team and Node.js development",maintenance and evolution of software,3 - 10 years,Software company in private sector,1 (myself only),Never,Never,Never,A few times a day/every day,A few times a month,A few times a day/every day,NA,I do not know the tool,I do not know the tool,I do not know the tool,I do not know the tool,I do not know the tool,I do not know the tool,I do not know the tool,I do not know the tool,I do not know the tool,I do not know the tool,I do not know the tool,I do not know the tool,I do not know the tool,I do not know the tool,Very relevant,I do not know the tool,I do not know the tool,Relevant,I do not know the tool,I do not know the tool,I do not know the tool,I do not know the tool,I do not know the tool,I do not know the tool,I do not know the tool,I do not know the tool,I do not know the tool,I do not know the tool,I do not know the tool,I do not know the tool,I do not know the tool,I do not know the tool,I do not know the tool,I do not know the tool,I do not know the tool,I do not know the tool,Very relevant,I do not know the tool,I do not know the tool,I do not know the tool,I do not know the tool,I do not know the tool,I do not know the tool,I do not know the tool,I do not know the tool,I do not know the tool,I do not know the tool,I do not know the tool,I do not know the tool,I do not know the tool,I do not know the tool,Yes,No,09:34:00,N/A
16/11/2016 02:46:47,08:12:00,Senior Software Developer,"Analysis, design and development of ERP systems",development of new software,3 - 10 years,Software company in private sector,More than 10,Never,Never,Never,Never,Never,A few times a day/every day,Team Foundation Server,I do not know the tool,I do not know the tool,I do not know the tool,I do not know the tool,I do not know the tool,I do not know the tool,I do not know the tool,I do not know the tool,I do not know the tool,I do not know the tool,I do not know the tool,I do not know the tool,I do not know the tool,I do not know the tool,I do not know the tool,I do not know the tool,I do not know the tool,I do not know the tool,I do not know the tool,I do not know the tool,I do not know the tool,I do not know the tool,I do not know the tool,I do not know the tool,I do not know the tool,I do not know the tool,I do not know the tool,I do not know the tool,I do not know the tool,I do not know the tool,I do not know the tool,I do not know the tool,I do not know the tool,I do not know the tool,I do not know the tool,I do not know the tool,Very relevant,I do not know the tool,I do not know the tool,I do not know the tool,I do not know the tool,I do not know the tool,I do not know the tool,I do not know the tool,I do not know the tool,I do not know the tool,I do not know the tool,I do not know the tool,I do not know the tool,I do not know the tool,I do not know the tool,Yes,Yes,08:16:00,
16/11/2016 03:24:02,10:50:00,Tech Lead,Team management and coding,development of new software,3 - 10 years,Software company in private sector,6 - 10,Weekly,Weekly,Weekly,A few times a month,A few times a month,A few times a day/every day,Jira,I do not know the tool,I do not know the tool,I do not know the tool,I do not know the tool,I do not know the tool,I do not know the tool,Relevant,I do not know the tool,I do not know the tool,I do not know the tool,I do not know the tool,I do not know the tool,I do not know the tool,I do not know the tool,I do not know the tool,I do not know the tool,I do not know the tool,Very relevant,I do not know the tool,I do not know the tool,I do not know the tool,I do not know the tool,I do not know the tool,I do not know the tool,I do not know the tool,I do not know the tool,I do not know the tool,I do not know the tool,I do not know the tool,I do not know the tool,I do not know the tool,I do not know the tool,I do not know the tool,I do not know the tool,I do not know the tool,I do not know the tool,I do not know the tool,I do not know the tool,I do not know the tool,I do not know the tool,I do not know the tool,I do not know the tool,I do not know the tool,I do not know the tool,I do not know the tool,I do not know the tool,I do not know the tool,I do not know the tool,Relevant,I do not know the tool,I do not know the tool,Yes,No,10:54:00,No
16/11/2016 04:08:26,09:04:00,Android Developer,Develop software,maintenance and evolution of software,3 - 10 years,Software company in private sector,More than 10,A few times a week,A few times a week,A few times a week,Never,A few times a day/every day,A few times a day/every day,JIRA,I do not know the tool,I do not know the tool,I do not know the tool,I do not know the tool,I do not know the tool,I do not know the tool,Very relevant,I do not know the tool,I do not know the tool,I do not know the tool,I do not know the tool,I do not know the tool,I do not know the tool,Relevant,I do not know the tool,I do not know the tool,I do not know the tool,Very relevant,Relevant,I do not know the tool,I do not know the tool,I do not know the tool,I do not know the tool,I do not know the tool,I do not know the tool,I do not know the tool,I do not know the tool,I do not know the tool,I do not know the tool,Very relevant,I do not know the tool,I do not know the tool,I do not know the tool,I do not know the tool,I do not know the tool,I do not know the tool,I do not know the tool,I do not know the tool,I do not know the tool,I do not know the tool,I do not know the tool,Relevant,I do not know the tool,I do not know the tool,I do not know the tool,I do not know the tool,I do not know the tool,Very relevant,I do not know the tool,I do not know the tool,I do not know the tool,Yes,Yes,09:08:00,
16/11/2016 04:13:07,11:40:00,Technical Lead,"Project management, people management, design and development of software",development of new software,10 - 20 years,Software company in private sector,2 - 5,A few times a day/every day,A few times a month,A few times a day/every day,A few times a day/every day,A few times a month,A few times a day/every day,Jira,I do not know the tool,I do not know the tool,I do not know the tool,I do not know the tool,I do not know the tool,I do not know the tool,Not very relevant,I do not know the tool,I do not know the tool,I do not know the tool,I do not know the tool,I do not know the tool,I do not know the tool,I do not know the tool,Relevant,Relevant,I do not know the tool,Very relevant,I do not know the tool,I do not know the tool,I do not know the tool,I do not know the tool,I do not know the tool,I do not know the tool,I do not know the tool,I do not know the tool,I do not know the tool,I do not know the tool,I do not know the tool,I do not know the tool,I do not know the tool,I do not know the tool,I do not know the tool,I do not know the tool,I do not know the tool,I do not know the tool,I do not know the tool,I do not know the tool,I do not know the tool,I do not know the tool,I do not know the tool,I do not know the tool,I do not know the tool,I do not know the tool,I do not know the tool,I do not know the tool,I do not know the tool,I do not know the tool,I do not know the tool,I do not know the tool,I do not know the tool,Yes,Yes,11:43:00,
16/11/2016 04:24:23,08:18:00,Senior programmer,Developing new functionality and maintaining old ones,maintenance and evolution of software,3 - 10 years,Software company in private sector,2 - 5,Less than monthly,Weekly,Weekly,A few times a month,Less than monthly,A few times a day/every day,YouTrack,I do not know the tool,I do not know the tool,I do not know the tool,I do not know the tool,I do not know the tool,I do not know the tool,I do not know the tool,I do not know the tool,I do not know the tool,I do not know the tool,I do not know the tool,I do not know the tool,I do not know the tool,I do not know the tool,I do not know the tool,I do not know the tool,I do not know the tool,I do not know the tool,I do not know the tool,I do not know the tool,I do not know the tool,I do not know the tool,I do not know the tool,I do not know the tool,I do not know the tool,I do not know the tool,I do not know the tool,I do not know the tool,I do not know the tool,I do not know the tool,I do not know the tool,I do not know the tool,I do not know the tool,I do not know the tool,I do not know the tool,I do not know the tool,I do not know the tool,I do not know the tool,I do not know the tool,I do not know the tool,I do not know the tool,I do not know the tool,I do not know the tool,I do not know the tool,I do not know the tool,Not very relevant,I do not know the tool,Very relevant,I do not know the tool,I do not know the tool,I do not know the tool,No,No,08:23:00,Too much radio buttons for CRMS selection
16/11/2016 05:34:16,09:30:00,iOS Technologies Manager,"Review the solutions (code) created by developers, architect applications for iOS devices",development of new software,10 - 20 years,Software company in private sector,6 - 10,A few times a week,Weekly,Weekly,Less than monthly,A few times a month,Weekly,Gitlab,I do not know the tool,I do not know the tool,I do not know the tool,I do not know the tool,I do not know the tool,I do not know the tool,Not very relevant,I do not know the tool,Not very relevant,I do not know the tool,I do not know the tool,I do not know the tool,I do not know the tool,Not very relevant,I do not know the tool,I do not know the tool,I do not know the tool,Not very relevant,I do not know the tool,I do not know the tool,I do not know the tool,I do not know the tool,I do not know the tool,I do not know the tool,I do not know the tool,Not very relevant,I do not know the tool,I do not know the tool,I do not know the tool,Not very relevant,I do not know the tool,I do not know the tool,I do not know the tool,I do not know the tool,I do not know the tool,I do not know the tool,Not very relevant,I do not know the tool,I do not know the tool,I do not know the tool,I do not know the tool,I do not know the tool,I do not know the tool,I do not know the tool,I do not know the tool,I do not know the tool,I do not know the tool,I do not know the tool,I do not know the tool,I do not know the tool,I do not know the tool,No,No,09:34:00,
16/11/2016 18:18:45,22:15:00,developer,web development,development of new software,3 - 10 years,Software company in governament sector,2 - 5,A few times a day/every day,A few times a day/every day,A few times a day/every day,A few times a day/every day,A few times a day/every day,A few times a day/every day,TFS,I do not know the tool,I do not know the tool,I do not know the tool,I do not know the tool,I do not know the tool,I do not know the tool,I do not know the tool,I do not know the tool,I do not know the tool,I do not know the tool,I do not know the tool,I do not know the tool,I do not know the tool,I do not know the tool,I do not know the tool,I do not know the tool,I do not know the tool,I do not know the tool,I do not know the tool,I do not know the tool,I do not know the tool,I do not know the tool,I do not know the tool,I do not know the tool,I do not know the tool,I do not know the tool,I do not know the tool,I do not know the tool,I do not know the tool,I do not know the tool,I do not know the tool,I do not know the tool,I do not know the tool,I do not know the tool,I do not know the tool,I do not know the tool,Very relevant,I do not know the tool,I do not know the tool,I do not know the tool,I do not know the tool,I do not know the tool,I do not know the tool,I do not know the tool,I do not know the tool,I do not know the tool,I do not know the tool,I do not know the tool,I do not know the tool,I do not know the tool,I do not know the tool,Yes,Yes,22:18:00,you have typos in the survey. (studant => student)
17/11/2016 01:43:16,09:05:00,IBM India Pvt Ltd,"I am involved in architecting, developing new functions for a product along with maintaining it. I am also work with lot of customers to develop solutions for them. ",development of new software,10 - 20 years,Software company in private sector,6 - 10,A few times a week,A few times a week,A few times a week,A few times a week,,,IBM Rational Team Concert,I do not know the tool,I do not know the tool,I do not know the tool,I do not know the tool,I do not know the tool,I do not know the tool,Relevant,I do not know the tool,I do not know the tool,I do not know the tool,I do not know the tool,I do not know the tool,I do not know the tool,I do not know the tool,I do not know the tool,I do not know the tool,Very relevant,I do not know the tool,I do not know the tool,I do not know the tool,I do not know the tool,I do not know the tool,Not very relevant,I do not know the tool,I do not know the tool,I do not know the tool,I do not know the tool,I do not know the tool,I do not know the tool,I do not know the tool,I do not know the tool,I do not know the tool,I do not know the tool,I do not know the tool,I do not know the tool,I do not know the tool,I do not know the tool,I do not know the tool,I do not know the tool,I do not know the tool,I do not know the tool,I do not know the tool,I do not know the tool,I do not know the tool,I do not know the tool,I do not know the tool,I do not know the tool,I do not know the tool,I do not know the tool,I do not know the tool,Relevant,Yes,Yes,09:13:00,
17/11/2016 04:22:09,11:04:00,Software Engineer,"I manage and develop the backend system.
Daily Tasks include:
- Findout bottlenecks, build strategy to solve them
- Improve performance of database
- Research & development to extract best available tools
- Manage bug/change lists
- Ready workflows/calculation of impact of a change request on overall system, modify the request if necessary",maintenance and evolution of software,Less than 03 years,Software company in private sector,2 - 5,Never,Weekly,A few times a week,A few times a day/every day,,,trello,I do not know the tool,I do not know the tool,I do not know the tool,I do not know the tool,I do not know the tool,I do not know the tool,I do not know the tool,I do not know the tool,I do not know the tool,I do not know the tool,I do not know the tool,I do not know the tool,I do not know the tool,I do not know the tool,I do not know the tool,I do not know the tool,I do not know the tool,Relevant,I do not know the tool,I do not know the tool,I do not know the tool,I do not know the tool,I do not know the tool,I do not know the tool,I do not know the tool,I do not know the tool,I do not know the tool,I do not know the tool,I do not know the tool,I do not know the tool,I do not know the tool,I do not know the tool,I do not know the tool,I do not know the tool,I do not know the tool,I do not know the tool,Not very relevant,I do not know the tool,I do not know the tool,I do not know the tool,I do not know the tool,I do not know the tool,I do not know the tool,I do not know the tool,I do not know the tool,I do not know the tool,I do not know the tool,I do not know the tool,I do not know the tool,I do not know the tool,I do not know the tool,Yes,Yes,11:11:00,
17/11/2016 05:03:25,00:54:00,Senior Software Analyst,"Technical lead of current team. System analysis and design, review others work, release estimation and planning, development of some core portions etc.",development of new software,3 - 10 years,Software company in private sector,More than 10,A few times a day/every day,A few times a day/every day,A few times a week,A few times a week,,,Redmine,I do not know the tool,I do not know the tool,I do not know the tool,I do not know the tool,I do not know the tool,I do not know the tool,Relevant,I do not know the tool,I do not know the tool,I do not know the tool,I do not know the tool,I do not know the tool,I do not know the tool,I do not know the tool,I do not know the tool,I do not know the tool,I do not know the tool,Very relevant,I do not know the tool,I do not know the tool,I do not know the tool,I do not know the tool,I do not know the tool,I do not know the tool,I do not know the tool,I do not know the tool,I do not know the tool,I do not know the tool,I do not know the tool,Very relevant,I do not know the tool,I do not know the tool,I do not know the tool,I do not know the tool,I do not know the tool,I do not know the tool,I do not know the tool,I do not know the tool,I do not know the tool,I do not know the tool,I do not know the tool,I do not know the tool,I do not know the tool,I do not know the tool,I do not know the tool,I do not know the tool,I do not know the tool,I do not know the tool,I do not know the tool,I do not know the tool,I do not know the tool,No,No,13:10:00,
19/11/2016 07:23:45,10:10:00,Senior Java/Full Stack Software Engineer/Technical Leader,Stand up meeting / design software architecture / write code/development new software / support team,development of new software,10 - 20 years,I am a student,2 - 5,A few times a week,A few times a month,Weekly,A few times a day/every day,,,jira,I do not know the tool,I do not know the tool,I do not know the tool,I do not know the tool,I do not know the tool,I do not know the tool,Not very relevant,I do not know the tool,I do not know the tool,I do not know the tool,I do not know the tool,I do not know the tool,I do not know the tool,I do not know the tool,I do not know the tool,I do not know the tool,I do not know the tool,Very relevant,I do not know the tool,I do not know the tool,I do not know the tool,I do not know the tool,I do not know the tool,I do not know the tool,Not very relevant,I do not know the tool,I do not know the tool,I do not know the tool,I do not know the tool,Relevant,I do not know the tool,I do not know the tool,I do not know the tool,I do not know the tool,I do not know the tool,I do not know the tool,I do not know the tool,I do not know the tool,I do not know the tool,I do not know the tool,I do not know the tool,I do not know the tool,I do not know the tool,I do not know the tool,I do not know the tool,I do not know the tool,I do not know the tool,I do not know the tool,I do not know the tool,I do not know the tool,I do not know the tool,Yes,Yes,10:20:00,
21/11/2016 00:05:06,07:45:00,iOS Developer,"code,test,fix bugs,add features",development of new software,Less than 03 years,Software company in private sector,2 - 5,A few times a week,Never,Never,A few times a week,,,jira,I do not know the tool,I do not know the tool,I do not know the tool,I do not know the tool,I do not know the tool,I do not know the tool,I do not know the tool,I do not know the tool,I do not know the tool,I do not know the tool,I do not know the tool,I do not know the tool,I do not know the tool,I do not know the tool,I do not know the tool,I do not know the tool,I do not know the tool,Very relevant,I do not know the tool,I do not know the tool,I do not know the tool,I do not know the tool,I do not know the tool,I do not know the tool,I do not know the tool,I do not know the tool,I do not know the tool,I do not know the tool,I do not know the tool,I do not know the tool,I do not know the tool,I do not know the tool,I do not know the tool,I do not know the tool,I do not know the tool,I do not know the tool,I do not know the tool,I do not know the tool,I do not know the tool,I do not know the tool,I do not know the tool,I do not know the tool,I do not know the tool,I do not know the tool,I do not know the tool,I do not know the tool,I do not know the tool,I do not know the tool,I do not know the tool,I do not know the tool,I do not know the tool,Yes,Yes,07:50:00,nope
21/11/2016 00:31:52,06:21:00,iOS Chief Software Architect,"Review changes, review and develop future requests",maintenance and evolution of software,3 - 10 years,Software company in private sector,More than 10,A few times a week,A few times a week,A few times a week,A few times a day/every day,,,JIRA,I do not know the tool,Relevant,I do not know the tool,I do not know the tool,I do not know the tool,I do not know the tool,Relevant,I do not know the tool,I do not know the tool,I do not know the tool,I do not know the tool,I do not know the tool,I do not know the tool,I do not know the tool,I do not know the tool,I do not know the tool,I do not know the tool,Very relevant,I do not know the tool,I do not know the tool,I do not know the tool,I do not know the tool,I do not know the tool,I do not know the tool,I do not know the tool,I do not know the tool,I do not know the tool,I do not know the tool,I do not know the tool,I do not know the tool,I do not know the tool,I do not know the tool,I do not know the tool,I do not know the tool,I do not know the tool,I do not know the tool,I do not know the tool,I do not know the tool,I do not know the tool,I do not know the tool,I do not know the tool,I do not know the tool,I do not know the tool,I do not know the tool,I do not know the tool,I do not know the tool,I do not know the tool,I do not know the tool,I do not know the tool,I do not know the tool,I do not know the tool,Yes,No,06:30:00,
21/11/2016 02:09:41,06:00:00,software engineer (android),"write code (new projects, new features, enhancement,bug fixes), code review, reading",maintenance and evolution of software,3 - 10 years,Software company in private sector,More than 10,Weekly,Less than monthly,Less than monthly,A few times a day/every day,,,jira,I do not know the tool,I do not know the tool,I do not know the tool,I do not know the tool,I do not know the tool,I do not know the tool,I do not know the tool,I do not know the tool,I do not know the tool,I do not know the tool,I do not know the tool,I do not know the tool,I do not know the tool,I do not know the tool,I do not know the tool,I do not know the tool,I do not know the tool,Very relevant,I do not know the tool,I do not know the tool,I do not know the tool,Relevant,I do not know the tool,I do not know the tool,I do not know the tool,I do not know the tool,I do not know the tool,I do not know the tool,I do not know the tool,I do not know the tool,I do not know the tool,I do not know the tool,I do not know the tool,I do not know the tool,I do not know the tool,I do not know the tool,I do not know the tool,I do not know the tool,I do not know the tool,I do not know the tool,I do not know the tool,I do not know the tool,I do not know the tool,I do not know the tool,I do not know the tool,I do not know the tool,I do not know the tool,I do not know the tool,I do not know the tool,I do not know the tool,I do not know the tool,Yes,No,06:10:00,
21/11/2016 02:23:14,09:44:00,Software Architect,"Software system design, client management, project management and code review.",development of new software,3 - 10 years,Software company in private sector,2 - 5,Weekly,A few times a week,A few times a week,A few times a month,,,Bugzilla,I do not know the tool,Not very relevant,I do not know the tool,I do not know the tool,I do not know the tool,Nothing relevant,Very relevant,I do not know the tool,I do not know the tool,I do not know the tool,I do not know the tool,I do not know the tool,I do not know the tool,Relevant,Relevant,I do not know the tool,I do not know the tool,Very relevant,I do not know the tool,Very relevant,I do not know the tool,Very relevant,I do not know the tool,I do not know the tool,I do not know the tool,I do not know the tool,I do not know the tool,I do not know the tool,I do not know the tool,Very relevant,I do not know the tool,I do not know the tool,I do not know the tool,I do not know the tool,I do not know the tool,I do not know the tool,I do not know the tool,I do not know the tool,I do not know the tool,I do not know the tool,I do not know the tool,I do not know the tool,I do not know the tool,I do not know the tool,I do not know the tool,I do not know the tool,I do not know the tool,I do not know the tool,I do not know the tool,I do not know the tool,I do not know the tool,Yes,Yes,10:01:00,The list of CRMS provided is very long and I haven't heard about most of them.
