Indicação de data e hora,Enter the time you started.,"In your organization context, what is your job title?",Please make a brief description of what you do during your workday.,"Considering your current occupation, please identify the activities you are more engaged with",For how long have you been working in development or software maintenance?,How do you classify your workplace?,What is the current size of your team?,How often are you engaged in the following activities? [Enter Change Request in CRMS],How often are you engaged in the following activities? [To decide whether a Change Request will be accepted or rejected and what type of maintenance should be applied.],How often are you engaged in the following activities? [To manage the Request Change queue and assignment Change Request to develop.],How often are you engaged in the following activities? [Write code],How often are you engaged in the following activities? [To manage the Request Change queue and assignment Change Request to develop.],How often are you engaged in the following activities? [Write code],Enter the name of Change Request Management System that you currently use.,"For each of the following tools, we would like that you assess the relevance of each inside the domain of CRMS. [Apache Bloodhound]","For each of the following tools, we would like that you assess the relevance of each inside the domain of CRMS. [Assembla Tickets]","For each of the following tools, we would like that you assess the relevance of each inside the domain of CRMS. [Axosoft]","For each of the following tools, we would like that you assess the relevance of each inside the domain of CRMS. [BMC Remedy Action Request System]","For each of the following tools, we would like that you assess the relevance of each inside the domain of CRMS. [Bontq]","For each of the following tools, we would like that you assess the relevance of each inside the domain of CRMS. [Brimir]","For each of the following tools, we would like that you assess the relevance of each inside the domain of CRMS. [Bugzilla]","For each of the following tools, we would like that you assess the relevance of each inside the domain of CRMS. [Debbugs]","For each of the following tools, we would like that you assess the relevance of each inside the domain of CRMS. [FogBugz]","For each of the following tools, we would like that you assess the relevance of each inside the domain of CRMS. [Fossil SCM]","For each of the following tools, we would like that you assess the relevance of each inside the domain of CRMS. [FusionForge]","For each of the following tools, we would like that you assess the relevance of each inside the domain of CRMS. [Gestionnaire libre de parc informatique]","For each of the following tools, we would like that you assess the relevance of each inside the domain of CRMS. [GNATS GNU]","For each of the following tools, we would like that you assess the relevance of each inside the domain of CRMS. [Google Code Hosting]","For each of the following tools, we would like that you assess the relevance of each inside the domain of CRMS. [HP Quality Center]","For each of the following tools, we would like that you assess the relevance of each inside the domain of CRMS. [IBM Rational ClearQuest]","For each of the following tools, we would like that you assess the relevance of each inside the domain of CRMS. [IBM Rational Team Concert]","For each of the following tools, we would like that you assess the relevance of each inside the domain of CRMS. [JIRA Software]","For each of the following tools, we would like that you assess the relevance of each inside the domain of CRMS. [Kayako SupportSuite]","For each of the following tools, we would like that you assess the relevance of each inside the domain of CRMS. [Launchpad]","For each of the following tools, we would like that you assess the relevance of each inside the domain of CRMS. [Liberum Help Desk]","For each of the following tools, we would like that you assess the relevance of each inside the domain of CRMS. [Mantis Bug Tracker]","For each of the following tools, we would like that you assess the relevance of each inside the domain of CRMS. [Microsoft Dynamics CRM]","For each of the following tools, we would like that you assess the relevance of each inside the domain of CRMS. [org-mode]","For each of the following tools, we would like that you assess the relevance of each inside the domain of CRMS. [Open-source Ticket Request System]","For each of the following tools, we would like that you assess the relevance of each inside the domain of CRMS. [Pivotal Tracker]","For each of the following tools, we would like that you assess the relevance of each inside the domain of CRMS. [Plain Ticket]","For each of the following tools, we would like that you assess the relevance of each inside the domain of CRMS. [Planbox]","For each of the following tools, we would like that you assess the relevance of each inside the domain of CRMS. [QuickBase]","For each of the following tools, we would like that you assess the relevance of each inside the domain of CRMS. [Redmine]","For each of the following tools, we would like that you assess the relevance of each inside the domain of CRMS. [Request Tracker]","For each of the following tools, we would like that you assess the relevance of each inside the domain of CRMS. [Roundup Issue Tracker]","For each of the following tools, we would like that you assess the relevance of each inside the domain of CRMS. [StarTeam]","For each of the following tools, we would like that you assess the relevance of each inside the domain of CRMS. [Supportworks]","For each of the following tools, we would like that you assess the relevance of each inside the domain of CRMS. [SysAid]","For each of the following tools, we would like that you assess the relevance of each inside the domain of CRMS. [Targetprocess]","For each of the following tools, we would like that you assess the relevance of each inside the domain of CRMS. [Team Foundation Server]","For each of the following tools, we would like that you assess the relevance of each inside the domain of CRMS. [Twproject]","For each of the following tools, we would like that you assess the relevance of each inside the domain of CRMS. [TechExcel's DevTrack]","For each of the following tools, we would like that you assess the relevance of each inside the domain of CRMS. [TestTrack]","For each of the following tools, we would like that you assess the relevance of each inside the domain of CRMS. [The Bug Genie]","For each of the following tools, we would like that you assess the relevance of each inside the domain of CRMS. [Trac Bug Tracking System]","For each of the following tools, we would like that you assess the relevance of each inside the domain of CRMS. [TrackerSuite.Net]","For each of the following tools, we would like that you assess the relevance of each inside the domain of CRMS. [Tuleap]","For each of the following tools, we would like that you assess the relevance of each inside the domain of CRMS. [Usersnap Bug Tracking System]","For each of the following tools, we would like that you assess the relevance of each inside the domain of CRMS. [Web Help Desk]","For each of the following tools, we would like that you assess the relevance of each inside the domain of CRMS. [Wrike Project management software]","For each of the following tools, we would like that you assess the relevance of each inside the domain of CRMS. [YouTrack]","For each of the following tools, we would like that you assess the relevance of each inside the domain of CRMS. [Zoho BugTracker]","For each of the following tools, we would like that you assess the relevance of each inside the domain of CRMS. [CA Service Desk]","For each of the following tools, we would like that you assess the relevance of each inside the domain of CRMS. [SourceSafe]",Would you like to receive the results of this research,Would you like to participate in other research about the theme?,Enter the time you finished,Would you like to include additional information or suggestions about this research?
14/11/2016 00:04:31,18:00:00,Software Developer,"Design, develop, and maintain software",maintenance and evolution of software,3 - 10 years,Software company in private sector,More than 10,A few times a week,A few times a week,Weekly,Less than monthly,A few times a month,A few times a day/every day,JIRA,I do not know the tool,I do not know the tool,I do not know the tool,I do not know the tool,I do not know the tool,I do not know the tool,Relevant,I do not know the tool,I do not know the tool,I do not know the tool,I do not know the tool,I do not know the tool,I do not know the tool,I do not know the tool,I do not know the tool,I do not know the tool,I do not know the tool,Very relevant,I do not know the tool,I do not know the tool,I do not know the tool,I do not know the tool,I do not know the tool,I do not know the tool,I do not know the tool,I do not know the tool,I do not know the tool,Relevant,I do not know the tool,I do not know the tool,I do not know the tool,I do not know the tool,I do not know the tool,I do not know the tool,I do not know the tool,I do not know the tool,I do not know the tool,I do not know the tool,I do not know the tool,I do not know the tool,I do not know the tool,I do not know the tool,I do not know the tool,I do not know the tool,I do not know the tool,I do not know the tool,I do not know the tool,I do not know the tool,I do not know the tool,I do not know the tool,I do not know the tool,No,No,18:05:00,
14/11/2016 00:33:17,18:28:00,Software Engineer,Learn about the build systems for the new project I'm working on.,maintenance and evolution of software,More than 20 years,Software company in private sector,More than 10,Less than monthly,A few times a month,A few times a month,Less than monthly,Less than monthly,A few times a month,RTC,I do not know the tool,I do not know the tool,I do not know the tool,I do not know the tool,I do not know the tool,I do not know the tool,I do not know the tool,I do not know the tool,I do not know the tool,I do not know the tool,I do not know the tool,I do not know the tool,I do not know the tool,I do not know the tool,I do not know the tool,Not very relevant,Relevant,Very relevant,I do not know the tool,I do not know the tool,I do not know the tool,I do not know the tool,I do not know the tool,I do not know the tool,I do not know the tool,I do not know the tool,I do not know the tool,I do not know the tool,I do not know the tool,I do not know the tool,I do not know the tool,I do not know the tool,I do not know the tool,I do not know the tool,I do not know the tool,I do not know the tool,I do not know the tool,I do not know the tool,I do not know the tool,I do not know the tool,I do not know the tool,I do not know the tool,I do not know the tool,I do not know the tool,I do not know the tool,I do not know the tool,I do not know the tool,I do not know the tool,I do not know the tool,I do not know the tool,I do not know the tool,No,No,18:32:00,
14/11/2016 05:21:13,07:17:00,Senior Software Engineer,"Coding, meetings, writing docs",development of new software,More than 20 years,Software company in private sector,2 - 5,A few times a week,A few times a week,A few times a week,A few times a month,A few times a month,A few times a day/every day,Github,I do not know the tool,I do not know the tool,I do not know the tool,I do not know the tool,I do not know the tool,I do not know the tool,Very relevant,I do not know the tool,Relevant,I do not know the tool,I do not know the tool,I do not know the tool,I do not know the tool,Not very relevant,I do not know the tool,I do not know the tool,I do not know the tool,Relevant,I do not know the tool,I do not know the tool,I do not know the tool,I do not know the tool,I do not know the tool,I do not know the tool,Very relevant,Relevant,I do not know the tool,I do not know the tool,I do not know the tool,I do not know the tool,I do not know the tool,I do not know the tool,I do not know the tool,I do not know the tool,I do not know the tool,I do not know the tool,Relevant,I do not know the tool,I do not know the tool,Not very relevant,I do not know the tool,Not very relevant,I do not know the tool,I do not know the tool,I do not know the tool,I do not know the tool,I do not know the tool,I do not know the tool,I do not know the tool,I do not know the tool,Nothing relevant,No,No,07:20:00,
15/11/2016 20:00:13,23:53:00,Developer,Code,development of new software,3 - 10 years,Software company in governament sector,6 - 10,A few times a month,Less than monthly,Less than monthly,Never,Never,A few times a month,Jira,I do not know the tool,I do not know the tool,I do not know the tool,I do not know the tool,I do not know the tool,I do not know the tool,Nothing relevant,I do not know the tool,I do not know the tool,I do not know the tool,I do not know the tool,I do not know the tool,I do not know the tool,I do not know the tool,I do not know the tool,I do not know the tool,I do not know the tool,Very relevant,I do not know the tool,I do not know the tool,I do not know the tool,I do not know the tool,I do not know the tool,I do not know the tool,I do not know the tool,I do not know the tool,I do not know the tool,I do not know the tool,I do not know the tool,I do not know the tool,I do not know the tool,Relevant,I do not know the tool,I do not know the tool,I do not know the tool,I do not know the tool,I do not know the tool,I do not know the tool,I do not know the tool,I do not know the tool,I do not know the tool,I do not know the tool,I do not know the tool,I do not know the tool,I do not know the tool,I do not know the tool,I do not know the tool,I do not know the tool,I do not know the tool,I do not know the tool,I do not know the tool,Yes,Yes,23:59:00,
15/11/2016 20:13:09,17:06:00,Developer (only open-source contributions),Not employed (student; solely open-source contributions),I am a studant,I am a student,I am a studant,1 (myself only),Less than monthly,A few times a month,Less than monthly,Never,Never,A few times a day/every day,GitHub Pull Requests,I do not know the tool,I do not know the tool,I do not know the tool,I do not know the tool,I do not know the tool,I do not know the tool,I do not know the tool,I do not know the tool,I do not know the tool,I do not know the tool,I do not know the tool,I do not know the tool,I do not know the tool,Nothing relevant,I do not know the tool,I do not know the tool,I do not know the tool,I do not know the tool,I do not know the tool,Nothing relevant,I do not know the tool,Nothing relevant,I do not know the tool,I do not know the tool,Relevant,I do not know the tool,Nothing relevant,I do not know the tool,I do not know the tool,I do not know the tool,Nothing relevant,Relevant,I do not know the tool,I do not know the tool,I do not know the tool,I do not know the tool,I do not know the tool,I do not know the tool,I do not know the tool,I do not know the tool,I do not know the tool,I do not know the tool,I do not know the tool,I do not know the tool,I do not know the tool,I do not know the tool,I do not know the tool,I do not know the tool,I do not know the tool,I do not know the tool,I do not know the tool,No,No,17:11:00,I am not employed and only contribute to open-source software. My answers do not accurately represent actual use of these tools.
15/11/2016 20:51:04,14:47:00,Software Developer,Develop software,maintenance and evolution of software,10 - 20 years,Open source project,More than 10,A few times a month,Weekly,Weekly,Weekly,A few times a month,Weekly,Roundup (bugs.python.org fork),I do not know the tool,I do not know the tool,I do not know the tool,I do not know the tool,I do not know the tool,I do not know the tool,Nothing relevant,I do not know the tool,Nothing relevant,Nothing relevant,I do not know the tool,I do not know the tool,I do not know the tool,Nothing relevant,I do not know the tool,I do not know the tool,I do not know the tool,Nothing relevant,I do not know the tool,Nothing relevant,I do not know the tool,I do not know the tool,Nothing relevant,Nothing relevant,I do not know the tool,Nothing relevant,I do not know the tool,I do not know the tool,I do not know the tool,I do not know the tool,I do not know the tool,Very relevant,I do not know the tool,I do not know the tool,I do not know the tool,I do not know the tool,Nothing relevant,I do not know the tool,I do not know the tool,I do not know the tool,I do not know the tool,Nothing relevant,I do not know the tool,I do not know the tool,I do not know the tool,I do not know the tool,I do not know the tool,I do not know the tool,Nothing relevant,I do not know the tool,Nothing relevant,No,No,14:50:00,"The options of ""do not know"" and ""nothing relevant"" doesn't seemingly cover ""I know of the tool but don't use it"""
15/11/2016 22:26:09,22:16:00,Software Engineer,Backend/frontend development,"Both new software and maintenance, mostly new things",10 - 20 years,Software company in private sector,2 - 5,Never,Never,A few times a week,A few times a month,Less than monthly,A few times a day/every day,Trello,I do not know the tool,I do not know the tool,I do not know the tool,I do not know the tool,I do not know the tool,I do not know the tool,Not very relevant,I do not know the tool,Relevant,I do not know the tool,I do not know the tool,I do not know the tool,I do not know the tool,Not very relevant,I do not know the tool,I do not know the tool,I do not know the tool,I do not know the tool,I do not know the tool,I do not know the tool,I do not know the tool,I do not know the tool,I do not know the tool,I do not know the tool,I do not know the tool,Relevant,I do not know the tool,I do not know the tool,I do not know the tool,I do not know the tool,I do not know the tool,I do not know the tool,I do not know the tool,I do not know the tool,I do not know the tool,I do not know the tool,Not very relevant,I do not know the tool,I do not know the tool,I do not know the tool,I do not know the tool,I do not know the tool,I do not know the tool,I do not know the tool,I do not know the tool,I do not know the tool,I do not know the tool,I do not know the tool,I do not know the tool,I do not know the tool,Nothing relevant,No,No,22:25:00,
15/11/2016 22:59:06,13:53:00,Software Developer,Code,development of new software,More than 20 years,Software company in private sector,6 - 10,A few times a week,A few times a week,A few times a week,A few times a week,A few times a week,A few times a day/every day,Youtrack,I do not know the tool,I do not know the tool,I do not know the tool,I do not know the tool,I do not know the tool,I do not know the tool,Relevant,I do not know the tool,Relevant,I do not know the tool,I do not know the tool,I do not know the tool,I do not know the tool,Nothing relevant,I do not know the tool,Relevant,I do not know the tool,Relevant,I do not know the tool,I do not know the tool,I do not know the tool,I do not know the tool,Nothing relevant,I do not know the tool,I do not know the tool,I do not know the tool,I do not know the tool,I do not know the tool,I do not know the tool,Relevant,I do not know the tool,I do not know the tool,I do not know the tool,I do not know the tool,I do not know the tool,I do not know the tool,Not very relevant,I do not know the tool,I do not know the tool,I do not know the tool,I do not know the tool,I do not know the tool,I do not know the tool,I do not know the tool,I do not know the tool,I do not know the tool,I do not know the tool,Very relevant,I do not know the tool,I do not know the tool,Nothing relevant,No,No,13:57:00,"this is a really really really bad survey, too many terms are highly subjective"
15/11/2016 23:28:08,02:22:00,Technical lead,"Architecture, training of coworkers, development, tooling,...",maintenance and evolution of software,3 - 10 years,Software company in private sector,2 - 5,A few times a month,Less than monthly,A few times a month,Never,Never,A few times a day/every day,Jira,I do not know the tool,I do not know the tool,I do not know the tool,I do not know the tool,I do not know the tool,I do not know the tool,I do not know the tool,I do not know the tool,Very relevant,I do not know the tool,I do not know the tool,I do not know the tool,I do not know the tool,I do not know the tool,I do not know the tool,I do not know the tool,I do not know the tool,Very relevant,I do not know the tool,I do not know the tool,I do not know the tool,I do not know the tool,Nothing relevant,I do not know the tool,I do not know the tool,I do not know the tool,I do not know the tool,I do not know the tool,I do not know the tool,Very relevant,I do not know the tool,I do not know the tool,I do not know the tool,I do not know the tool,I do not know the tool,I do not know the tool,Relevant,I do not know the tool,I do not know the tool,I do not know the tool,I do not know the tool,I do not know the tool,I do not know the tool,I do not know the tool,I do not know the tool,I do not know the tool,I do not know the tool,I do not know the tool,I do not know the tool,I do not know the tool,Nothing relevant,Yes,No,02:27:00,
16/11/2016 00:06:26,21:56:00,Senior Developer / Architect,Design and write software solutions. ,development of new software,More than 20 years,Software company in private sector,2 - 5,Weekly,Weekly,Weekly,Weekly,Weekly,A few times a day/every day,Bitbucket Issue Tracker,I do not know the tool,I do not know the tool,I do not know the tool,I do not know the tool,I do not know the tool,I do not know the tool,Very relevant,I do not know the tool,I do not know the tool,I do not know the tool,I do not know the tool,I do not know the tool,I do not know the tool,Not very relevant,I do not know the tool,I do not know the tool,I do not know the tool,Relevant,I do not know the tool,I do not know the tool,I do not know the tool,Not very relevant,I do not know the tool,I do not know the tool,I do not know the tool,I do not know the tool,I do not know the tool,I do not know the tool,I do not know the tool,Very relevant,I do not know the tool,I do not know the tool,I do not know the tool,I do not know the tool,I do not know the tool,I do not know the tool,I do not know the tool,I do not know the tool,I do not know the tool,I do not know the tool,I do not know the tool,I do not know the tool,I do not know the tool,I do not know the tool,I do not know the tool,I do not know the tool,I do not know the tool,I do not know the tool,I do not know the tool,I do not know the tool,I do not know the tool,Yes,No,22:03:00,
16/11/2016 01:04:59,08:31:00,sdet,"automation ,sometimes development",maintenance and evolution of software,3 - 10 years,Software company in private sector,2 - 5,Never,Never,Never,Never,Never,A few times a day/every day,Jira,I do not know the tool,I do not know the tool,I do not know the tool,I do not know the tool,I do not know the tool,I do not know the tool,I do not know the tool,I do not know the tool,I do not know the tool,I do not know the tool,I do not know the tool,I do not know the tool,I do not know the tool,I do not know the tool,Not very relevant,I do not know the tool,I do not know the tool,Very relevant,I do not know the tool,I do not know the tool,I do not know the tool,I do not know the tool,I do not know the tool,I do not know the tool,I do not know the tool,I do not know the tool,I do not know the tool,I do not know the tool,I do not know the tool,I do not know the tool,I do not know the tool,I do not know the tool,I do not know the tool,I do not know the tool,I do not know the tool,I do not know the tool,I do not know the tool,I do not know the tool,I do not know the tool,I do not know the tool,Not very relevant,I do not know the tool,I do not know the tool,I do not know the tool,I do not know the tool,I do not know the tool,I do not know the tool,I do not know the tool,I do not know the tool,I do not know the tool,I do not know the tool,No,No,08:34:00,
16/11/2016 01:22:31,08:40:00,Sr. Software Engineer,"I will get assignments from my client/the team lead, I will analyse the works and split up into modules and assign to my team members according to their capabilities. I will always try to keep in touch with them and will care to do important modules by myself and integrate team members works as well.",development of new software,Less than 03 years,Software company in private sector,2 - 5,A few times a week,Less than monthly,Weekly,A few times a week,A few times a week,A few times a day/every day,we don't use any tools for this,I do not know the tool,I do not know the tool,I do not know the tool,I do not know the tool,I do not know the tool,I do not know the tool,I do not know the tool,I do not know the tool,I do not know the tool,I do not know the tool,I do not know the tool,I do not know the tool,I do not know the tool,I do not know the tool,I do not know the tool,I do not know the tool,I do not know the tool,I do not know the tool,I do not know the tool,I do not know the tool,I do not know the tool,I do not know the tool,I do not know the tool,I do not know the tool,I do not know the tool,I do not know the tool,I do not know the tool,I do not know the tool,I do not know the tool,I do not know the tool,I do not know the tool,I do not know the tool,I do not know the tool,I do not know the tool,I do not know the tool,I do not know the tool,I do not know the tool,I do not know the tool,I do not know the tool,I do not know the tool,I do not know the tool,I do not know the tool,I do not know the tool,I do not know the tool,I do not know the tool,I do not know the tool,I do not know the tool,I do not know the tool,I do not know the tool,I do not know the tool,I do not know the tool,Yes,No,08:51:00,Nothing special
